{
 "$schemaVersion": 1,
 "$note": "This work includes material from the System Reference Document 5.2.1 (“SRD 5.2.1”) by Wizards of the Coast LLC, available at https://www.dndbeyond.com/srd. The SRD 5.2.1 is licensed under the Creative Commons Attribution 4.0 International License, available at https://creativecommons.org/licenses/by/4.0/legalcode. Read from the official SRD_CC_v5.2.1.pdf by tools/extract/extract_srd52.py; page numbers are that document's.",
 "book": "5e SRD 5.2.1",
 "chapter": "Character Creation",
 "page": 19,
 "entries": [
  {
   "id": "srd52.character_creation.choose_a_character_sheet",
   "name": "Choose a Character Sheet",
   "kind": "section",
   "page": 19,
   "blocks": [
    {
     "t": "p",
     "text": "You’ll record the main details of your character on a character sheet. Throughout this chapter, we use the term “character sheet” to mean whatever you use to track your character’s details, whether it’s a printed character sheet, a digital character sheet, or plain paper. Choose whichever style of sheet works for you, and then embark on creating a character!",
     "page": 19
    }
   ]
  },
  {
   "id": "srd52.character_creation.create_your_character",
   "name": "Create Your Character",
   "kind": "section",
   "page": 19,
   "blocks": [
    {
     "t": "p",
     "text": "Here are the steps to make a character; each step is explored in detail:",
     "page": 19
    },
    {
     "t": "p",
     "text": "1: Choose a Class. Every adventurer is a member of a class. A class broadly describes a character’s vocation, special talents, and favored tactics.",
     "lead": "1: Choose a Class.",
     "page": 19
    },
    {
     "t": "p",
     "text": "2: Determine Origin. A character’s origin includes two elements: background and species. How did the character spend the years leading up to a life of adventure? Who are the character’s ancestors? You can also choose your character’s languages.",
     "lead": "2: Determine Origin.",
     "page": 19
    },
    {
     "t": "p",
     "text": "3: Determine Ability Scores. Much of what your character does in the game depends on the character’s six abilities.",
     "lead": "3: Determine Ability Scores.",
     "page": 19
    },
    {
     "t": "p",
     "text": "4: Choose an Alignment. Alignment is a shorthand for your character’s moral compass.",
     "lead": "4: Choose an Alignment.",
     "page": 19
    },
    {
     "t": "p",
     "text": "5: Fill in Details. Using the choices you’ve made, fill in the remaining details on your character sheet.",
     "lead": "5: Fill in Details.",
     "page": 19
    },
    {
     "t": "h",
     "level": 2,
     "text": "Step 1: Choose Class",
     "page": 19
    },
    {
     "t": "p",
     "text": "Choose a class, and write it on your character sheet. The Class Overview table summarizes the classes. See “Classes” for the classes’ details.",
     "page": 19
    },
    {
     "t": "table",
     "title": "Class Overview",
     "rows": [
      [
       "Class",
       "Likes ...",
       "Primary Ability",
       "Complexity"
      ],
      [
       "Barbarian",
       "Battle",
       "Strength",
       "Average"
      ],
      [
       "Bard",
       "Performing",
       "Charisma",
       "High"
      ],
      [
       "Cleric",
       "Gods",
       "Wisdom",
       "Average"
      ],
      [
       "Druid",
       "Nature",
       "Wisdom",
       "High"
      ],
      [
       "Fighter",
       "Weapons",
       "Strength or Dexterity",
       "Low"
      ],
      [
       "Monk",
       "Unarmed combat",
       "Dexterity and Wisdom",
       "High"
      ],
      [
       "Paladin",
       "Defense",
       "Strength and Charisma",
       "Average"
      ],
      [
       "Ranger",
       "Survival",
       "Dexterity and Wisdom",
       "Average"
      ],
      [
       "Class",
       "Likes ...",
       "Primary",
       "Complexity"
      ],
      [
       "",
       "",
       "Ability",
       ""
      ],
      [
       "Rogue",
       "Stealth",
       "Dexterity",
       "Low"
      ],
      [
       "Sorcerer",
       "Power",
       "Charisma",
       "High"
      ],
      [
       "Warlock",
       "Occult lore",
       "Charisma",
       "High"
      ],
      [
       "Wizard",
       "Spellbooks",
       "Intelligence",
       "Average"
      ]
     ],
     "page": 19
    },
    {
     "t": "h",
     "level": 3,
     "text": "Write Your Level",
     "page": 19
    },
    {
     "t": "p",
     "text": "Write your character’s level on your character sheet. Typically, a character starts at level 1 and advances in level by adventuring and gaining Experience Points (XP).",
     "page": 19
    },
    {
     "t": "p",
     "text": "Write Your XP. Also record your Experience Points. A level 1 character has 0 XP.",
     "lead": "Write Your XP.",
     "page": 19
    },
    {
     "t": "p",
     "text": "Starting at a Higher Level. Your GM might start you at a higher level. If you start at level 3 or higher, write your chosen subclass on your character sheet. See the “Starting at Higher Levels” section later in “Character Creation” for more information.",
     "lead": "Starting at a Higher Level.",
     "page": 19
    },
    {
     "t": "h",
     "level": 3,
     "text": "Note Armor Training",
     "page": 19
    },
    {
     "t": "p",
     "text": "Your class might give you training with certain categories of armor. Note your armor training on your character sheet. Armor training with a kind of armor means you can wear that armor effectively, gaining defensive bonuses from it. The categories of armor are described in “Equipment.”",
     "page": 19
    },
    {
     "t": "h",
     "level": 2,
     "text": "Step 2: Character Origin",
     "page": 19
    },
    {
     "t": "p",
     "text": "Determining your character’s origin involves choosing a background, a species, and two languages.",
     "page": 19
    },
    {
     "t": "p",
     "text": "A character’s background represents the place and occupation that were most formative for the character. The combination of background, species, and languages provides fertile soil for your imagination as you ponder your character’s earliest days.",
     "page": 19
    },
    {
     "t": "h",
     "level": 3,
     "text": "Choose a Background",
     "page": 19
    },
    {
     "t": "p",
     "text": "Choose your character’s background, and write it on your character sheet. You can choose any of the backgrounds detailed in “Character Origins,” and your GM might offer additional backgrounds as options.",
     "page": 19
    },
    {
     "t": "p",
     "text": "The background you choose influences step 3, when you determine your character’s ability scores. If you’re having trouble choosing, the Ability Scores and Backgrounds table shows which backgrounds benefit which ability scores. Look for your class’s primary ability there.",
     "page": 19
    },
    {
     "t": "table",
     "title": "Ability Scores and Backgrounds",
     "rows": [
      [
       "Ability",
       "Background"
      ],
      [
       "Strength",
       "Soldier"
      ],
      [
       "Dexterity",
       "Soldier"
      ],
      [
       "Constitution",
       "Soldier"
      ],
      [
       "Intelligence",
       "Acolyte"
      ],
      [
       "Wisdom",
       "Acolyte"
      ],
      [
       "Charisma",
       "Acolyte"
      ]
     ],
     "page": 19
    },
    {
     "t": "p",
     "text": "Record Your Feat. A background gives you a feat, which grants your character particular capabilities. Feats are detailed in “Feats.” Write the feat on your character sheet.",
     "lead": "Record Your Feat.",
     "page": 20
    },
    {
     "t": "p",
     "text": "Note Proficiencies. Your background gives proficiency in two skills and with one tool. Record this information on your character sheet.",
     "lead": "Note Proficiencies.",
     "page": 20
    },
    {
     "t": "p",
     "text": "Your class also gives proficiencies. Check your class description in “Classes” and note the proficiencies on your character sheet.",
     "page": 20
    },
    {
     "t": "p",
     "text": "The features table in your class description shows your Proficiency Bonus (described in “Playing the Game”), which is +2 for a level 1 character. Note this number on your character sheet. You’ll fill in other numbers connected to these proficiencies in step 5.",
     "page": 20
    },
    {
     "t": "h",
     "level": 3,
     "text": "Choose Starting Equipment",
     "page": 20
    },
    {
     "t": "p",
     "text": "Your background and class both provide starting equipment. Any coins that you gain at this step can be immediately spent on equipment from “Equipment.”",
     "page": 20
    },
    {
     "t": "p",
     "text": "Record your chosen equipment on your character sheet. Equipment is described in “Equipment,” but for now you can just write it all down and look up the specifics in “Equipment” later. Note any coins you have left after purchasing your equipment.",
     "page": 20
    },
    {
     "t": "h",
     "level": 3,
     "text": "Choose a Species",
     "page": 20
    },
    {
     "t": "p",
     "text": "Choose a species for your character. The following species options are detailed in “Character Origins”: Dragonborn, Dwarf, Elf, Gnome, Goliath, Halfling, Human, Orc, and Tiefling. Once you’ve chosen a species, write it on your character sheet. Then record your species’ traits.",
     "page": 20
    },
    {
     "t": "p",
     "text": "Your character’s size and Speed are determined by the character’s species; record these in the appropriate places on your character sheet as well (you may write just the first letter of your size).",
     "page": 20
    },
    {
     "t": "h",
     "level": 3,
     "text": "Imagine Your Past and Present",
     "page": 20
    },
    {
     "t": "p",